<?xml version="1.0" encoding="UTF-8"?>
<vivero
xmlns:xsi="http://www.w3.org/2001/XMLSchema-instance"
xsi:noNamespaceSchemaLocation="vivero.xsd"
>
    <especie siembra="2019">
        <nombre>Litchi</nombre>
        <precio moneda="euro">25</precio>
        <variedad>Kway May Pink</variedad>
        <origen>Filipinas</origen>
        <color_fruto>rojo</color_fruto>
        <color_fruto>rosa</color_fruto>
        <otros_datos>
            <maduracion>agosto</maduracion>
            <riesgo>diario</riesgo>
        </otros_datos>
    </especie>
    <especie siembra="2018">
        <nombre>Longan</nombre>
        <precio moneda="euro">10</precio>
        <variedad>Champoo</variedad>
        <origen>China</origen>
        <color_fruto>mar√≥n</color_fruto>
        <otros_datos>
            <maduracion>octubre</maduracion>
            <riesgo>diario</riesgo>
        </otros_datos>
    </especie>  
    <especie siembra="2017">
        <nombre>Litchi</nombre>
        <precio moneda="euro">21</precio>
        <variedad>mauritius</variedad>
        <origen>Florida</origen>
        <color_fruto>rojo</color_fruto>
        <otros_datos>
            <maduracion>agosto</maduracion>
            <riesgo>diario</riesgo>
        </otros_datos>
    </especie>
</vivero>
